{
  "$schema": "../../../../../docs/design/level.schema.json",
  "formatVersion": 1,
  "id": "level_0013",
  "slots": 3,
  "trayCapacity": 4,
  "colors": ["R", "O", "B", "G"],
  "stack": {
    "cols": 7,
    "rows": 4,
    "layers": [
      [
        "ORROOBO",
        "GRRROBG",
        "GBGRORG",
        "ORGGGRB"
      ],
      [
        "obobgbb",
        "orooobr",
        "grbboor",
        "orbbobr"
      ],
      [
        "goggb..",
        "brorg..",
        "brrog..",
        "rbbgb.."
      ]
    ]
  },
  "lanes": [
    ["R", "G", "O", "B", "B", "O"],
    ["G", "B", "G", "G", "B", "O", "R"],
    ["O", "R", "B", "O", "R", "R"]
  ],
  "view": { "cameraPreset": "default", "stackScale": 1 },
  "meta": { "name": "Mystery Tower", "difficulty": "hard", "notes": "Approximates reference video 2 (visible ground, hidden rainbow tiers above).", "solution": [0, 1, 2, 2, 2, 0, 1, 1, 2, 1, 0, 1, 2, 0, 2, 0, 1, 1, 0] }
}
