{
  "$schema": "../../../../docs/design/level.schema.json",
  "formatVersion": 1,
  "id": "level_0002",
  "slots": 3,
  "trayCapacity": 4,
  "colors": ["R", "B"],
  "stack": {
    "cols": 4,
    "rows": 3,
    "layers": [
      [
        "RBBB",
        "RRRB",
        "RRRR"
      ]
    ]
  },
  "lanes": [
    ["R"],
    ["R"],
    ["B"]
  ],
  "view": { "cameraPreset": "default", "stackScale": 1 },
  "meta": { "name": "Three Belts", "difficulty": "tutorial", "notes": "Teaches: three conveyors, the belt steps forward.", "solution": [0, 1, 2] }
}
