{
  "$schema": "../../../../../docs/design/level.schema.json",
  "formatVersion": 1,
  "id": "level_0012",
  "slots": 3,
  "trayCapacity": 4,
  "colors": ["R", "O", "B", "G"],
  "stack": {
    "cols": 9,
    "rows": 6,
    "layers": [
      [
        "..BGGOO..",
        ".ORGGRRG.",
        "OORGOGRGO",
        "RBRORGORO",
        ".BBORGGO.",
        "..OGROG.."
      ],
      [
        ".........",
        "..GOOGG..",
        ".BBOGBBR.",
        ".RBBRBBR.",
        "..BRROB..",
        "........."
      ],
      [
        ".........",
        "...RBG...",
        "..RRBBB..",
        "..RGOBG..",
        "..RROBR..",
        "........."
      ]
    ]
  },
  "lanes": [
    ["R", "G", "O", "O", "G", "B", "R"],
    ["G", "R", "R", "B", "R", "G", "O"],
    ["O", "B", "R", "O", "B", "G", "B"]
  ],
  "view": { "cameraPreset": "default", "stackScale": 1 },
  "meta": { "name": "Cake Tower", "difficulty": "hard", "notes": "Approximates reference video 1 (three visible tiers, no hidden bottles).", "solution": [2, 0, 1, 0, 0, 2, 1, 0, 2, 1, 2, 1, 1, 2, 2, 0, 0, 0, 2, 1, 1] }
}
