{
  "$schema": "../../../../../docs/design/level.schema.json",
  "formatVersion": 1,
  "id": "level_0015",
  "slots": 3,
  "trayCapacity": 4,
  "colors": ["R", "O", "B", "G", "P"],
  "stack": {
    "cols": 8,
    "rows": 5,
    "layers": [
      [
        "RBOGRRBR",
        "ORGBBOBR",
        "ORPBBOPG",
        "GOPBROPP",
        "GPPBGPRP"
      ],
      [
        ".rrbrbp.",
        ".ggrbgo.",
        ".ggrggo.",
        ".ggoogo.",
        "........"
      ],
      [
        "..obop..",
        "..orbb..",
        "..obpr..",
        "........",
        "........"
      ]
    ]
  },
  "lanes": [
    ["B", "G", "G", "O", "G", "B"],
    ["P", "P", "G", "R", "R", "O"],
    ["R", "O", "P", "B", "O", "B", "R"]
  ],
  "view": { "cameraPreset": "default", "stackScale": 1 },
  "meta": { "name": "Rainbow Chaos", "difficulty": "hard", "solution": [2, 0, 1, 2, 0, 1, 0, 0, 1, 1, 2, 0, 2, 2, 2, 1, 2, 1, 0] }
}
