{
  "$schema": "../../../../../docs/design/level.schema.json",
  "formatVersion": 1,
  "id": "level_0008",
  "slots": 3,
  "trayCapacity": 4,
  "colors": ["R", "O", "B", "G"],
  "stack": {
    "cols": 8,
    "rows": 5,
    "layers": [
      [
        "RRBBRGRG",
        "BBGORBOO",
        "OOBOBROO",
        "OBGGGRRB",
        "OBGGGBRB"
      ],
      [
        "........",
        ".GGGRGG.",
        ".ORBRGR.",
        ".ORBROR.",
        ".OBBOOG."
      ]
    ]
  },
  "lanes": [
    ["G", "R", "O", "B", "G", "R"],
    ["O", "B", "O", "R", "G"],
    ["B", "G", "O", "B", "R"]
  ],
  "view": { "cameraPreset": "default", "stackScale": 1 },
  "meta": { "name": "Wide Crate", "difficulty": "medium", "solution": [0, 2, 1, 1, 1, 0, 0, 2, 0, 1, 2, 0, 2, 0, 1, 2] }
}
