{
  "$schema": "../../../../../docs/design/level.schema.json",
  "formatVersion": 1,
  "id": "level_0001",
  "slots": 1,
  "trayCapacity": 4,
  "colors": ["R", "O"],
  "stack": {
    "cols": 4,
    "rows": 2,
    "layers": [
      [
        "RROO",
        "RROO"
      ]
    ]
  },
  "lanes": [
    ["O"],
    ["R"]
  ],
  "view": { "cameraPreset": "default", "stackScale": 1 },
  "meta": { "name": "First Caps", "difficulty": "tutorial", "notes": "Teaches: tap a tray, bottles fly in, the box ships.", "solution": [0, 1] }
}
